{"id":"gmail-compose","title":"כתיבת הודעה חדשה","language":"he","direction":"rtl","product":"Gmail","version":"Web","topic":"כתיבה ושליחה של הודעת דוא״ל","audience":"מבוגרים מתחילים","learningGoal":"הלומד יוכל לפתוח הודעה חדשה, למלא נמען, נושא ותוכן ולשלוח אותה.","status":"review","sources":[{"publisher":"Google Workspace Learning Center","title":"Write & send email","url":"https://support.google.com/a/users/answer/9259768?hl=en","checkedAt":"2026-09-12"}],"assets":[],"blocks":[{"type":"lead","heading":"מה כוללת הודעה חדשה","content":"נמען, נושא, גוף ההודעה וכפתור שליחה."},{"type":"interface-map","heading":"חלון כתיבת ההודעה","content":"ממתין לצילום Gmail אמיתי ומאומת."},{"type":"step-by-step","heading":"כתיבת ההודעה","content":["פתיחת Gmail","בחירה בכתיבה","הוספת נמענים","הוספת נושא","כתיבת ההודעה","שליחה"]},{"type":"important","heading":"בדיקה לפני שליחה","content":"בדיקת הנמענים, הנושא והקבצים המצורפים."},{"type":"faq","heading":"שאלות נפוצות","content":["עותק ועותק מוסתר","שמירת טיוטה"]}]}
