{"id":"android-navigation","title":"ניווט בטלפון","language":"he","direction":"rtl","product":"Android","version":"גרסאות עדכניות; משתנה לפי היצרן","topic":"מעבר בין מסכים ויישומים","audience":"מבוגרים מתחילים","learningGoal":"הלומד יוכל לחזור, להגיע למסך הבית ולראות יישומים פתוחים באמצעות מחוות או שלושה לחצנים.","status":"review","sources":[{"publisher":"Android Help","title":"Get around on your Android device","url":"https://support.google.com/android/answer/9079644","checkedAt":"2026-09-12"}],"assets":[],"blocks":[{"type":"lead","heading":"שתי שיטות ניווט","content":"ניווט במחוות או ניווט באמצעות שלושה לחצנים."},{"type":"distinction","heading":"מחוות לעומת לחצנים","content":{"gesture":"החלקות מהקצוות ומתחתית המסך","buttons":"חזרה, בית ויישומים אחרונים"}},{"type":"step-by-step","heading":"הפעולות המרכזיות","content":["חזרה למסך הקודם","מעבר למסך הבית","הצגת יישומים פתוחים","מעבר בין יישומים"]},{"type":"important","heading":"הבדלים בין מכשירים","content":"הנתיב והסמלים עשויים להשתנות לפי היצרן והגרסה."},{"type":"interface-map","heading":"אזור הניווט","content":"נדרש צילום אמיתי של מכשיר וגרסה מוגדרים לפני אישור."}]}
