{"id":"windows-taskbar","title":"שורת המשימות","language":"he","direction":"rtl","product":"Windows","version":"Windows 11","topic":"הכרת הרכיבים המרכזיים בשורת המשימות","audience":"מבוגרים מתחילים","learningGoal":"הלומד יוכל לזהות את התחלה, חיפוש, תצוגת משימות ואזור המערכת.","status":"blocked","sources":[{"publisher":"Microsoft Support","title":"Navigate and explore the Windows taskbar","url":"https://support.microsoft.com/en-us/accessibility/windows/navigate-and-explore-the-windows-taskbar","checkedAt":"2026-09-12"}],"assets":[],"blocks":[{"type":"lead","heading":"מהי שורת המשימות","content":"רכיב מרכזי לגישה ליישומים, לתכונות ולהגדרות מערכת."},{"type":"interface-map","heading":"מפת שורת המשימות","content":"חסום עד להוספת צילום Windows 11 אמיתי ומאומת."},{"type":"concept","heading":"רכיבים מרכזיים","content":["התחלה","חיפוש","תצוגת משימות","יישומים מוצמדים","אזור המערכת"]},{"type":"distinction","heading":"מוצמד לעומת פתוח","content":"הבחנה בין קיצור דרך קבוע ליישום שפועל כעת."},{"type":"step-by-step","heading":"פתיחה באמצעות המקלדת","content":["פתיחת התחלה","פתיחת חיפוש","פתיחת הגדרות מהירות"]}]}
