{"id":"replace-with-page-id","title":"כותרת הדף","language":"he","direction":"rtl","product":"שם המוצר","version":null,"topic":"נושא אחד","audience":"מבוגרים מתחילים","learningGoal":"בסיום הקריאה הלומד יוכל להסביר או לבצע פעולה מוגדרת.","status":"draft","sources":[],"assets":[],"blocks":[{"type":"lead","heading":null,"content":"פתיח קצר שמסביר מהו הנושא ולמה הוא שימושי.","assetRef":null}]}
